<?xml version="1.0" encoding="UTF-8"?>
<xs:schema xmlns="http://www.uniovi.es" elementFormDefault="qualified" targetNamespace="http://www.uniovi.es" xmlns:xs="http://www.w3.org/2001/XMLSchema">
	<xs:element name="rutas">
		<xs:complexType>
			<xs:sequence>
				<xs:element minOccurs="1" maxOccurs="unbounded" ref="ruta" />
			</xs:sequence>
		</xs:complexType>
	</xs:element>
	<xs:element name="ruta">
		<xs:complexType>
			<xs:sequence>
				<xs:element ref="tipo" />
				<xs:element ref="medioTransporte" />
				<xs:element ref="duracion" />
				<xs:element ref="agencia" />
				<xs:element ref="descripcion" />
				<xs:element ref="personasAdecuadas" />
				<xs:element ref="lugarInicio" />
				<xs:element ref="direccionInicio" />
				<xs:element ref="coordenadasInicio" />
				<xs:element ref="referencias" />
				<xs:element ref="recomendacion" />
				<xs:element ref="hitos" />
				<xs:element ref="planimetria" />
				<xs:element ref="altimetria" />
			</xs:sequence>
			<xs:attribute name="nombreRuta" type="xs:string" use="required" />
			<xs:attribute name="fechaInicio" type="xs:date" />
			<xs:attribute name="horaInicio" type="xs:time" />
		</xs:complexType>
	</xs:element>
	<xs:element name="tipo" type="xs:string" />
	<xs:element name="medioTransporte" type="xs:string" />
	<xs:element name="duracion" type="xs:string" />
	<xs:element name="agencia" type="xs:string" />
	<xs:element name="descripcion" type="xs:string" />
	<xs:element name="personasAdecuadas" type="xs:string" />
	<xs:element name="lugarInicio" type="xs:string" />
	<xs:element name="direccionInicio" type="xs:string" />
	<xs:element name="coordenadasInicio">
		<xs:complexType>
			<xs:sequence>
				<xs:element ref="longitud" />
				<xs:element ref="latitud" />
				<xs:element ref="altitud" />
			</xs:sequence>
		</xs:complexType>
	</xs:element>
	<xs:element name="longitud" type="xs:float" />
	<xs:element name="latitud" type="xs:float" />
	<xs:element name="altitud" type="xs:float" />
	<xs:element name="referencias">
		<xs:complexType>
			<xs:sequence>
				<xs:element minOccurs="3" maxOccurs="unbounded" ref="referencia" />
			</xs:sequence>
		</xs:complexType>
	</xs:element>
	<xs:element name="referencia" type="xs:string" />
	<xs:element name="recomendacion">
        <xs:simpleType>
            <xs:restriction base="xs:integer">
                <xs:minInclusive value="0"/>
                <xs:maxExclusive value="10"/>
            </xs:restriction>
        </xs:simpleType>
    </xs:element>
	<xs:element name="hitos">
		<xs:complexType>
			<xs:sequence>
				<xs:element minOccurs="5" maxOccurs="unbounded" ref="hito" />
			</xs:sequence>
		</xs:complexType>
	</xs:element>
	<xs:element name="hito">
		<xs:complexType>
			<xs:sequence>
				<xs:element ref="nombreHito" />
				<xs:element ref="descripcionHito" />
				<xs:element ref="coordenadasHito" />
				<xs:element ref="galeriaFotosHito" />
				<xs:element minOccurs="0" maxOccurs="1" ref="galeriaVideosHito" />
			</xs:sequence>
			<xs:attribute name="distancia" type="xs:string" use="required" />
		</xs:complexType>
	</xs:element>
	<xs:element name="nombreHito" type="xs:string" />
	<xs:element name="descripcionHito" type="xs:string" />
	<xs:element name="coordenadasHito">
		<xs:complexType>
			<xs:sequence>
				<xs:element ref="longitud" />
				<xs:element ref="latitud" />
				<xs:element ref="altitud" />
			</xs:sequence>
		</xs:complexType>
	</xs:element>
	<xs:element name="galeriaFotosHito">
		<xs:complexType>
			<xs:sequence>
				<xs:element minOccurs="1" maxOccurs="5" ref="foto" />
			</xs:sequence>
		</xs:complexType>
	</xs:element>
	<xs:element name="foto" type="xs:string" />
	<xs:element name="galeriaVideosHito">
		<xs:complexType>
			<xs:sequence>
				<xs:element minOccurs="0" maxOccurs="3" ref="video" />
			</xs:sequence>
		</xs:complexType>
	</xs:element>
	<xs:element name="video" type="xs:string" />
	<xs:element name="planimetria" type="xs:string" />
	<xs:element name="altimetria" type="xs:string" />
</xs:schema>