<?xml version="1.0" encoding="UTF-8"?>
<rutas xsi:schemaLocation="http://www.uniovi.es rutas.xsd"
       xmlns:xsi="http://www.w3.org/2001/XMLSchema-instance" 
       xmlns="http://www.uniovi.es">    
       <ruta nombreRuta="Ruta del Patrimonio de Noreña" fechaInicio="2025-06-01" horaInicio="10:00:00">
        <tipo>Cultural y paisajística</tipo>
        <medioTransporte>A pie</medioTransporte>
        <duracion>2 horas y media</duracion>
        <agencia>Sin agencia</agencia>
        <descripcion>Ruta circular que recorre el casco histórico de Noreña y varios puntos de interés cultural y natural.</descripcion>
        <personasAdecuadas>Se puede ir con niños</personasAdecuadas>
        <lugarInicio>Plaza de la Cruz</lugarInicio>
        <direccionInicio>Calle Constitución, Noreña</direccionInicio>
        <coordenadasInicio> 
            <longitud>-5.6903</longitud>
            <latitud>43.3921</latitud>
            <altitud>280</altitud>
        </coordenadasInicio>
        <referencias>
            <referencia>https://www.aytonorena.es/</referencia>
            <referencia>https://es.wikipedia.org/wiki/Nore%C3%B1a</referencia>
            <referencia>https://turismoasturias.es/descubre/municipios/norena</referencia>
        </referencias>
        <recomendacion>9</recomendacion>
        <hitos>
            <hito distancia="0.500km">
                <nombreHito>Capilla del Ecce Homo</nombreHito>
                <descripcionHito>Capilla barroca del siglo XVIII, símbolo religioso de la villa.</descripcionHito>
                <coordenadasHito>
                    <longitud>-5.6921</longitud>                  
                    <latitud>43.3923</latitud>
                    <altitud>285</altitud>
                </coordenadasHito> 
                <galeriaFotosHito>
                    <foto>capilla_eccehomo.jpg</foto>
                </galeriaFotosHito>
            </hito>
            <hito distancia="0.350km">
                <nombreHito>Parque de los Riegos</nombreHito>
                <descripcionHito>Zona verde con vegetación autóctona y área infantil.</descripcionHito>
                <coordenadasHito>
                    <longitud>-5.6882</longitud>                    
                    <latitud>43.3909</latitud>
                    <altitud>275</altitud>
                </coordenadasHito> 
                <galeriaFotosHito>
                    <foto>parque_riegos.jpg</foto> 
                </galeriaFotosHito>
            </hito>
            <hito distancia="0.180km">
                <nombreHito>Casa Consistorial</nombreHito>
                <descripcionHito>Edificio del ayuntamiento, de gran valor arquitectónico.</descripcionHito>
                <coordenadasHito>
                    <longitud>-5.6901</longitud>                    
                    <latitud>43.3915</latitud>
                    <altitud>278</altitud> 
                </coordenadasHito> 
                <galeriaFotosHito>
                    <foto>ayuntamiento.jpg</foto>
                </galeriaFotosHito>
            </hito>
            <hito distancia="0.400km">
                <nombreHito>Parque de la Iglesia</nombreHito>
                <descripcionHito>Jardín junto a la iglesia de Santa María.</descripcionHito>
                <coordenadasHito>
                    <longitud>-5.6890</longitud>                    
                    <latitud>43.3926</latitud>
                    <altitud>282</altitud> 
                </coordenadasHito> 
                <galeriaFotosHito>
                    <foto>parque_iglesia.jpg</foto>
                </galeriaFotosHito>
            </hito>
            <hito distancia="0.500km">
                <nombreHito>Fuente de los Cuatro Caños</nombreHito>
                <descripcionHito>Fuente histórica del siglo XIX, en piedra labrada.</descripcionHito>
                <coordenadasHito>
                    <longitud>-5.6910</longitud>                    
                    <latitud>43.3934</latitud>
                    <altitud>284</altitud> 
                </coordenadasHito> 
                <galeriaFotosHito>
                    <foto>fuente_caños.jpg</foto>
                </galeriaFotosHito>
            </hito>
        </hitos>
        <planimetria>ruta1.kml</planimetria>
        <altimetria>ruta1.svg</altimetria>
    </ruta>    
    <ruta nombreRuta="Ruta de los Caminos Rurales de La Carrera y Hevia" fechaInicio="2025-07-10" horaInicio="09:30:00">
        <tipo>Paisajística</tipo>
        <medioTransporte>Bici o a pie</medioTransporte>
        <duracion>3 horas</duracion>
        <agencia>Sin agencia</agencia>
        <descripcion>Ruta entre caminos rurales de Siero, partiendo desde Noreña hacia La Carrera y Hevia, atravesando zonas ganaderas y bosques de castaños y robles.</descripcion>
        <personasAdecuadas>Apta para todos los públicos con condición física moderada</personasAdecuadas>
        <lugarInicio>Noreña - Plaza de la Cruz</lugarInicio>
        <direccionInicio>Calle Ramón y Cajal, Noreña</direccionInicio>
        <coordenadasInicio> 
            <longitud>-5.6905</longitud> 
            <latitud>43.3912</latitud>
            <altitud>282</altitud>
        </coordenadasInicio>
        <referencias>
            <referencia>https://www.rutasysenderos.es/comarca-del-nora/c/0/i/77372030/ruta-berron-hevia-santa-marina-y-paranza</referencia>
            <referencia>https://es.wikiloc.com/rutas/siero-norena-hevia-43354677</referencia>
            <referencia>https://turismoasturias.es/</referencia>
        </referencias>
        <recomendacion>8</recomendacion>
        <hitos>
            <hito distancia="1.200km">
                <nombreHito>Molino de Fonciello</nombreHito>
                <descripcionHito>Antiguo molino de agua restaurado, junto a un pequeño arroyo.</descripcionHito>
                <coordenadasHito>
                    <longitud>-5.6842</longitud>                  
                    <latitud>43.3886</latitud>
                    <altitud>270</altitud>
                </coordenadasHito> 
                <galeriaFotosHito>
                    <foto>molino_fonciello.jpg</foto>
                </galeriaFotosHito>
            </hito>
            <hito distancia="2.900km">
                <nombreHito>Área de descanso La Carrera</nombreHito>
                <descripcionHito>Zona recreativa con bancos, sombra y vistas a los prados de Siero.</descripcionHito>
                <coordenadasHito>
                    <longitud>-5.6775</longitud>                    
                    <latitud>43.3819</latitud>
                    <altitud>260</altitud>
                </coordenadasHito> 
                <galeriaFotosHito>
                    <foto>area_carrera.jpg</foto> 
                </galeriaFotosHito>
            </hito>
            <hito distancia="4.300km">
                <nombreHito>Iglesia de Hevia</nombreHito>
                <descripcionHito>Templo parroquial rodeado de árboles centenarios.</descripcionHito>
                <coordenadasHito>
                    <longitud>-5.6813</longitud>                    
                    <latitud>43.3741</latitud>
                    <altitud>275</altitud> 
                </coordenadasHito> 
                <galeriaFotosHito>
                    <foto>iglesia_hevia.jpg</foto>
                </galeriaFotosHito>
            </hito>
            <hito distancia="6.500km">
                <nombreHito>Fuente de La Peña</nombreHito>
                <descripcionHito>Fuente con agua fresca entre castaños, lugar ideal para descansar.</descripcionHito>
                <coordenadasHito>
                    <longitud>-5.6901</longitud>                    
                    <latitud>43.3810</latitud>
                    <altitud>273</altitud> 
                </coordenadasHito> 
                <galeriaFotosHito>
                    <foto>fuente_pena.jpg</foto>
                </galeriaFotosHito>
            </hito>
            <hito distancia="7.800km">
                <nombreHito>Plaza de la Cruz (Final)</nombreHito>
                <descripcionHito>Regreso al punto inicial en el centro de Noreña.</descripcionHito>
                <coordenadasHito>
                    <longitud>-5.6905</longitud>                    
                    <latitud>43.3912</latitud>
                    <altitud>282</altitud> 
                </coordenadasHito> 
                <galeriaFotosHito>
                    <foto>norena_cruz.jpg</foto>
                </galeriaFotosHito>
            </hito>
        </hitos>
        <planimetria>ruta2.kml</planimetria>
        <altimetria>ruta2.svg</altimetria>
    </ruta>    
    <ruta nombreRuta="Ruta de Santa Marina a Argüelles" fechaInicio="2025-08-02" horaInicio="10:00:00">
        <tipo>Paisajística</tipo>
        <medioTransporte>A pie o en bicicleta</medioTransporte>
        <duracion>2 horas y media</duracion>
        <agencia>Sin agencia</agencia>
        <descripcion>Ruta circular desde Noreña pasando por Santa Marina y Argüelles, con paisajes rurales, pastos y vistas a las montañas cercanas.</descripcion>
        <personasAdecuadas>Apta para familias y ciclistas ocasionales</personasAdecuadas>
        <lugarInicio>Plaza del Ayuntamiento de Noreña</lugarInicio>
        <direccionInicio>Calle Constitución, Noreña</direccionInicio>
        <coordenadasInicio> 
            <longitud>-5.6901</longitud> 
            <latitud>43.3905</latitud>
            <altitud>284</altitud>
        </coordenadasInicio>
        <referencias>
            <referencia>https://www.ayto-siero.es/rutas-de-senderismo/</referencia>
            <referencia>https://es.wikiloc.com/rutas-senderismo/santo-medero-y-santa-marina-de-los-cuclillos-desde-arguelles-162631179</referencia>